{
  "revision_id": "fxr_1",
  "fixture_uid": "fx_1",
  "revision_seq": 1,
  "change_type": "kickoff_change",
  "payload": {
    "kickoff_at": "2024-08-31T16:30:00Z"
  },
  "observed_at": "2026-07-21T12:00:00Z",
  "available_at": "2026-07-21T12:00:00Z",
  "published_at": "2026-07-21T12:00:00Z",
  "effective_at": "2026-07-21T12:00:00Z",
  "provenance": {
    "source_ids": [
      "fpl-official-endpoints"
    ],
    "transformation_version": "0.1.0",
    "ruleset_id": "2026-27-v0.1"
  }
}
